<?xml version ="1.0" encoding = "UTF 8"?>
<entities xmlns:xsi="http://www.w3.org/2001/XMLSchema-instance"
          xmlns="http://www.training.by/entities"
          xsi:schemaLocation="http://www.training.by/entities  xmlTest2.xsd">
<!--    <order>
        <id>1</id>
        <pizza>
            <id>1</id>
            <goods>
                <id>2</id>
                <name>Pepperoni</name>
                <description>Tomato sauce, mozzarella, pepperoni</description>
                <price>6.9</price>
                <picture>...</picture>
            </goods>
            <dough>
                <id>1</id>
                <name>Thick</name>
            </dough>
            <size>
                <id>1</id>
                <name>Small</name>
                <coefficient>1.0</coefficient>
            </size>
        </pizza>
        <orderPosition>
            <id>1</id>
            <date>2020-02-01</date>
            <user role="0">
                <login>admin</login>
                <password>1234</password>
            </user>
        </orderPosition>
        <price>6.9</price>
    </order>
</entities>-->

         <user role="2">
             <id>1</id>
             <login>admin</login>
             <pass>123456</pass>
             <email>admin@gmail.com</email>
             <userInfo>
                 <name>Артем</name>
                 <surname>Колганов</surname>
                 <phoneNumber>291111111</phoneNumber>
             </userInfo>
         </user>
         <order status="compilation">
             <id>2</id>
             <date>2020-02-01</date>
             <deliviredate>2020-03-05</deliviredate>
             <price>30.5</price>
             <productlist>
                 <product>
                     <id>1</id>
                     <quantity>3</quantity>
                 </product>
                 <product>
                     <id>2</id>
                     <quantity>5</quantity>
                 </product>
             </productlist>
         </order>
     </entities>